{
  "$schema": "https://json-schema.org/draft/2020-12/schema",
  "$id": "https://gait.dev/schemas/v1/gate/trace_record.schema.json",
  "title": "Gate Trace Record",
  "type": "object",
  "required": [
    "schema_id",
    "schema_version",
    "created_at",
    "producer_version",
    "trace_id",
    "tool_name",
    "args_digest",
    "intent_digest",
    "policy_digest",
    "verdict"
  ],
  "properties": {
    "schema_id": { "type": "string", "const": "gait.gate.trace" },
    "schema_version": { "type": "string", "pattern": "^1\\.0\\.0$" },
    "created_at": { "type": "string", "format": "date-time" },
    "producer_version": { "type": "string" },
    "trace_id": { "type": "string" },
    "tool_name": { "type": "string" },
    "args_digest": { "type": "string", "pattern": "^[a-fA-F0-9]{64}$" },
    "intent_digest": { "type": "string", "pattern": "^[a-fA-F0-9]{64}$" },
    "policy_digest": { "type": "string", "pattern": "^[a-fA-F0-9]{64}$" },
    "verdict": { "type": "string", "enum": ["allow", "block", "dry_run", "require_approval"] },
    "violations": { "type": "array", "items": { "type": "string" }, "default": [] },
    "latency_ms": { "type": "number" },
    "approval_token_ref": { "type": "string" },
    "signature": {
      "type": "object",
      "required": ["alg", "key_id", "sig"],
      "properties": {
        "alg": { "type": "string" },
        "key_id": { "type": "string" },
        "sig": { "type": "string" },
        "signed_digest": { "type": "string", "pattern": "^[a-fA-F0-9]{64}$" }
      },
      "additionalProperties": false
    }
  },
  "additionalProperties": false
}
