{
  "schema_id": "gait.gate.trace",
  "schema_version": "1.0.0",
  "created_at": "2026-02-10T00:00:00Z",
  "producer_version": "0.0.0-test",
  "trace_id": "trace_blocked_001",
  "tool_name": "tool.delete",
  "args_digest": "aaaaaaaaaaaaaaaaaaaaaaaaaaaaaaaaaaaaaaaaaaaaaaaaaaaaaaaaaaaaaaaa",
  "intent_digest": "bbbbbbbbbbbbbbbbbbbbbbbbbbbbbbbbbbbbbbbbbbbbbbbbbbbbbbbbbbbbbbbb",
  "policy_digest": "cccccccccccccccccccccccccccccccccccccccccccccccccccccccccccccccc",
  "verdict": "block",
  "violations": [
    "destructive_action"
  ],
  "latency_ms": 3.2,
  "signature": {
    "alg": "ed25519",
    "key_id": "dev",
    "sig": "demo"
  }
}
